{
  "$schema": "schemas/factory-package.schema.json",
  "schema_version": "1.0.0",
  "id": "factory.agent-team-engineering",
  "name": "Agent Team Engineering Factory",
  "version": "0.9.0",
  "status": "STABLE",
  "instance_schema_version": "1.0.0",
  "maximum_bootstrap_autonomy": "A2",
  "management_skill": "manage-agent-team-factory",
  "team_packs": [
    {
      "id": "team-pack.software-delivery",
      "version": "0.2.0",
      "path": "team-packs/software-delivery"
    }
  ],
  "contract_files": [
    "AI-BOOTSTRAP.md",
    "AI-START.md",
    ".agents/plugins/marketplace.json",
    ".agents/plugins/plugins/agent-team/.codex-plugin/plugin.json",
    ".agents/plugins/plugins/agent-team/.claude-plugin/plugin.json",
    ".agents/plugins/plugins/agent-team/skills/bootstrap-agent-team/SKILL.md",
    ".agents/plugins/plugins/agent-team/skills/bootstrap-agent-team/agents/openai.yaml",
    ".agents/plugins/plugins/agent-team/skills/bootstrap-agent-team/references/conversation-workflow.md",
    ".agents/plugins/plugins/agent-team/skills/bootstrap-agent-team/references/scenarios-and-commands.md",
    ".agents/plugins/plugins/agent-team/skills/install-agent-team-host/SKILL.md",
    ".agents/plugins/plugins/agent-team/skills/install-agent-team-host/agents/openai.yaml",
    ".claude-plugin/marketplace.json",
    "adapters/claude/adapter.json",
    "adapters/cli-model-router/adapter.json",
    "adapters/codex/adapter.json",
    "adapters/file-inbox/adapter.json",
    "adapters/generic-ai/adapter.json",
    "adapters/github/adapter.json",
    "adapters/local-dry-run/adapter.json",
    "adapters/manual-agent/adapter.json",
    "adapters/openclaw/adapter.json",
    "adapters/recording/adapter.json",
    "adapters/native-oci/adapter.json",
    "adapters/native-oci/descriptor.json",
    "adapters/swe-rex/adapter.json",
    "adapters/swe-rex/descriptor.json",
    "adapters/container-use/adapter.json",
    "adapters/container-use/descriptor.json",
    "adapters/openclaw/descriptor.json",
    "adapters/openhands/descriptor.json",
    "adapters/paperclip/descriptor.json",
    "adapters/acp/descriptor.json",
    "acceptance/cross-ai-takeover.json",
    "acceptance/github-scm-first-run.json",
    "acceptance/github-scm-replay.json",
    "acceptance/v08-native-conformance.json",
    "acceptance/v09-host-native-conformance.json",
    "contracts/core-contracts.json",
    "contracts/native-reference-workflow.json",
    "contracts/v07-to-v08-migration.json",
    "core/context_team.py",
    "core/guided_adoption.py",
    "core/host_catalog.py",
    "core/host_lifecycle.py",
    "contracts/runner-candidates.json",
    "contracts/external-adapter-candidates.json",
    "docs/01-principles/project-constitution.md",
    "docs/03-security/threat-model.md",
    "docs/05-adoption/existing-project-adoption.md",
    "docs/08-factory/instance-lifecycle.md",
    "docs/10-adapters/sdk-isolation-and-approval.md",
    "docs/11-lifecycle/installation-upgrade-and-adoption.md",
    "docs/12-acceptance/cross-ai-takeover.md",
    "docs/13-team-creator/blueprint-compiler-and-reference-runtime.md",
    "docs/14-context-first/context-first-team-kit.md",
    "docs/14-context-first/platform-installation.md",
    "docs/15-upstream-independent/core-contracts-and-migration.md",
    "docs/15-upstream-independent/adapter-port-sdk.md",
    "docs/15-upstream-independent/native-controller-and-conformance.md",
    "docs/15-upstream-independent/runner-scm-and-agent-boundaries.md",
    "docs/15-upstream-independent/adoption-and-integration.md",
    "docs/15-upstream-independent/README.md",
    "docs/16-release/v0.8-acceptance.md",
    "docs/16-release/v0.8.1-acceptance.md",
    "docs/16-release/v0.9-acceptance.md",
    "docs/17-guided-adoption/README.md",
    "docs/17-guided-adoption/conversation-protocol.md",
    "docs/17-guided-adoption/plan-contract.md",
    "docs/17-guided-adoption/faq.md",
    "docs/18-native-hosts/README.md",
    "docs/18-native-hosts/support-matrix.md",
    "docs/18-native-hosts/conversation-workflow.md",
    "docs/18-native-hosts/openclaw.md",
    "docs/18-native-hosts/hermes-agent.md",
    "docs/18-native-hosts/multica.md",
    "docs/adr/ADR-0005-versioned-adapter-host-and-bound-approval.md",
    "docs/adr/ADR-0006-verified-install-and-transactional-instance-lifecycle.md",
    "docs/adr/ADR-0007-team-blueprint-compiler-and-governed-reference-runtime.md",
    "docs/adr/ADR-0008-context-first-team-kits-and-discovery-bundles.md",
    "docs/adr/ADR-0009-vendor-neutral-core-and-replaceable-ports.md",
    "docs/adr/ADR-0010-scenario-first-guided-adoption.md",
    "docs/adr/ADR-0011-host-capability-contract-and-native-team-projection.md",
    "examples/v08-contracts/README.md",
    "examples/v08-contracts/invalid/cases.json",
    "examples/v08-contracts/valid/capability-report.json",
    "examples/github-scm-conformance/README.md",
    "examples/github-scm-conformance/workflow.yml",
    "policies/adapter-authority.json",
    "hosts/claude/host.json",
    "hosts/codex/host.json",
    "hosts/generic-ai/host.json",
    "hosts/hermes/host.json",
    "hosts/multica/host.json",
    "hosts/openclaw/host.json",
    "presets/custom.json",
    "presets/software-lite.json",
    "presets/software-managed.json",
    "schemas/adapter-empty-config.schema.json",
    "schemas/adapter-authority-policy.schema.json",
    "schemas/adapter-request.schema.json",
    "schemas/adapter-result.schema.json",
    "schemas/adapter.schema.json",
    "schemas/agent-result.schema.json",
    "schemas/agent-step-result.schema.json",
    "schemas/agent-step-task.schema.json",
    "schemas/approval-assertion.schema.json",
    "schemas/adapter-descriptor.schema.json",
    "schemas/approval-grant.schema.json",
    "schemas/capability-report.schema.json",
    "schemas/native-conformance-profile.schema.json",
    "schemas/command-envelope.schema.json",
    "schemas/event-envelope.schema.json",
    "schemas/evidence-bundle.schema.json",
    "schemas/plan-revision.schema.json",
    "schemas/role-contract.schema.json",
    "schemas/run.schema.json",
    "schemas/team-spec.schema.json",
    "schemas/work-item-v2.schema.json",
    "schemas/workflow-spec.schema.json",
    "schemas/approval-event.schema.json",
    "schemas/cli-model-router-config.schema.json",
    "schemas/adoption-package.schema.json",
    "schemas/adoption-project.schema.json",
    "schemas/adoption-report.schema.json",
    "schemas/adoption-risk-policy.schema.json",
    "schemas/doctor-report.schema.json",
    "schemas/execution-request.schema.json",
    "schemas/execution-result.schema.json",
    "schemas/external-reference.schema.json",
    "schemas/sandbox-profile.schema.json",
    "schemas/runner-conformance-report.schema.json",
    "schemas/github-change-set.schema.json",
    "schemas/github-scm-conformance-report.schema.json",
    "schemas/guided-adoption-plan.schema.json",
    "schemas/host-capability.schema.json",
    "schemas/host-conformance-report.schema.json",
    "schemas/host-install-lock.schema.json",
    "schemas/host-install-plan.schema.json",
    "schemas/feedback-event.schema.json",
    "schemas/feedback-notification.schema.json",
    "schemas/factory-installation.schema.json",
    "schemas/github-issue-create.schema.json",
    "schemas/github-pull-request-create.schema.json",
    "schemas/project-task-envelope.schema.json",
    "schemas/instance-lifecycle-journal.schema.json",
    "schemas/instance-recovery-manifest.schema.json",
    "schemas/instance-upgrade-plan.schema.json",
    "schemas/task-envelope.schema.json",
    "schemas/team-blueprint.schema.json",
    "schemas/team-design.schema.json",
    "schemas/context-team-lock.schema.json",
    "schemas/team-lock.schema.json",
    "schemas/runner-profile.schema.json",
    "schemas/work-item.schema.json",
    "skills/implement-agent-team-adapter/SKILL.md",
    "skills/create-agent-team/SKILL.md",
    "skills/create-agent-team/agents/openai.yaml",
    "skills/install-agent-team-host/SKILL.md",
    "skills/install-agent-team-host/agents/openai.yaml",
    "skills/upgrade-agent-team-instance/SKILL.md",
    "team-packs/software-delivery/context-policy.json",
    "team-packs/software-delivery/quality-gates.json",
    "team-packs/software-delivery/risk-policy.json",
    "team-packs/software-delivery/team-pack.json",
    "team-packs/software-delivery/tool-policy.json",
    "team-packs/software-delivery/workflow.json",
    "schemas/control-plane-audit.schema.json",
    "schemas/control-plane-status.schema.json",
    "schemas/cross-ai-takeover.schema.json",
    "schemas/outbox-effect.schema.json",
    "schemas/task-lease.schema.json",
    "docs/09-control-plane/persistence-and-recovery.md",
    ".github/workflows/disposable-runner.yml",
    ".github/workflows/release-verify.yml",
    "sbom/agent-team-engineering.spdx.json",
    "supply-chain/source-provenance.json"
  ]
}
